{
  "episode_id": "EP0001",
  "seed_id": "MILO-S0001",
  "bank_version": "2.1.0-compact",
  "seed_hash": "715603ef17316e12c798db9a12db295462588b5ee35c5ee891b9b16107339467",
  "seed_snapshot": {
    "seed_id": "MILO-S0001",
    "family_id": "F001",
    "territorio": "Padre y cariño",
    "angulo": "primera_vez",
    "titulo": "Plato tapado: la primera vez",
    "semilla": "Papá deja la cena aunque Milo llega tarde. Milo interpreta el silencio como distancia. Tratamiento: Milo observa por primera vez la situación y debe comprobar su interpretación antes de actuar.",
    "conflicto": "Milo interpreta el silencio como distancia",
    "accion_visible": "papá deja la cena aunque Milo llega tarde",
    "objeto_emocional": "plato tapado",
    "giro_posible": "el plato demuestra que alguien contó con su regreso",
    "desarrollo_requerido": "Mostrar situación → lectura inicial → detalle que contradice → pregunta o gesto concreto.",
    "milo_role": "adulto; recuerdo infantil solo si el guion lo justifica",
    "personajes_requeridos": [
      "Milo",
      "papá"
    ],
    "personajes_secundario": "Resolver identidad y disponibilidad de referencias desde canon antes de producir; no inventar anclas aprobadas.",
    "motor_editorial": "identificacion",
    "revision": {
      "calidad": 89.0,
      "afinidad": 90.0,
      "novedad": 85,
      "compuesto": 88.75,
      "nivel": "PRIORITARIA",
      "elegible": true,
      "bloqueos": []
    }
  },
  "title": "El plato tapado",
  "central_conflict": "Milo interpreta el silencio de papá como distancia.",
  "payoff": "El plato tapado y los dos cubiertos revelan que papá contó con su regreso.",
  "share_recipient": "Para quien alguna vez confundió el silencio de su papá con distancia.",
  "novelty_justification": "No usa diagnóstico ni aforismo de amor silencioso: convierte el plato tapado y los dos cubiertos en pruebas físicas de una interpretación que Milo comprueba antes de actuar. La progresión evita el cierre de «los padres no dicen te quiero» y se queda en un gesto concreto: sentarse.",
  "hooks": [
    {
      "id": "h1",
      "text": "Papá no dijo nada. Milo creyó que ya no lo esperaba.",
      "reason": "Reconocimiento inmediato del silencio familiar y del conflicto interpretativo, sin revelar el plato ni el perdón."
    },
    {
      "id": "h2",
      "text": "El plato estaba tapado. Y Milo pensó lo peor.",
      "reason": "Pone el objeto emocional en el centro y abre un bucle: ¿qué hay debajo o qué significa?"
    },
    {
      "id": "h3",
      "text": "Milo llegó tarde. La casa estaba en silencio.",
      "reason": "Entra por situación concreta y tensión doméstica, sin explicar todavía la relación padre-hijo."
    }
  ],
  "selected_hook_id": "h1",
  "music": false,
  "sfx": false,
  "beats": [
    {
      "beat_id": "b1",
      "function": "hook",
      "narration": "Papá no dijo nada. Milo creyó que ya no lo esperaba.",
      "new_information": "Milo llega tarde y lee el silencio como distancia.",
      "visual_action": "Milo adulto se detiene en la puerta de la cocina nocturna; al fondo, un plato tapado sobre la mesa.",
      "narration_visual_link": "La frase del silencio se apoya en la puerta y en el plato tapado.",
      "characters": [
        "milo_adult"
      ],
      "world_id": "kitchen_night",
      "voice_intention": "Entrar con curiosidad contenida y dejar caer la duda.",
      "pause_after_s": 0.4,
      "text_emphasis": [
        "Papá no dijo nada",
        "ya no lo esperaba"
      ],
      "shot": {
        "scale": "medium",
        "motion": "slow_push",
        "motion_reason": "Acercar al plato tapado sin revelarlo todavía.",
        "continuity": "Milo adulto entra desde el pasillo a la cocina nocturna.",
        "subtitle_safe_top": true
      },
      "transition": {
        "type": "cut",
        "duration_s": 0,
        "reason": "Inicio directo sin preparación."
      },
      "director_direction": {
        "viewer_emotion": "reconocimiento incómodo",
        "narrator_intention": "instalar la duda sin explicarla",
        "emotional_entry": "llegada tardía",
        "emotional_exit": "sospecha de distancia",
        "emphasis": "nada / ya no",
        "pause_reason": "separar el silencio de la interpretación",
        "visual_sync": "la pausa cae con la puerta y el plato tapado",
        "forbidden_delivery": "no dramatizar como abandono confirmado"
      },
      "director_voice_text": "[curious] Papá no dijo nada. [short pause] Milo creyó que ya no lo esperaba."
    },
    {
      "beat_id": "b2",
      "function": "reconocimiento táctil",
      "narration": "Milo tocó el plato.",
      "new_information": "Milo toca el plato: no está frío ni abandonado.",
      "visual_action": "Primer plano de la mano de Milo sobre el plato tapado.",
      "narration_visual_link": "El gesto de tocar convierte el plato en una prueba física.",
      "characters": [
        "milo_adult"
      ],
      "world_id": "kitchen_night",
      "voice_intention": "Descubrir con los dedos, casi en susurro.",
      "pause_after_s": 0.2,
      "text_emphasis": [
        "tocó el plato"
      ],
      "shot": {
        "scale": "close_up",
        "motion": "static",
        "motion_reason": "La quietud concentra el contacto con el objeto.",
        "continuity": "Misma mesa, luz nocturna.",
        "subtitle_safe_top": true
      },
      "transition": {
        "type": "cut",
        "duration_s": 0,
        "reason": "Pasar del conjunto al detalle táctil."
      },
      "director_direction": {
        "viewer_emotion": "curiosidad",
        "narrator_intention": "ofrecer una prueba sensorial",
        "emotional_entry": "sospecha",
        "emotional_exit": "atención",
        "emphasis": "tocó",
        "pause_reason": "dejar que el contacto hable",
        "visual_sync": "la mano toca el plato",
        "forbidden_delivery": "no resolver todavía"
      },
      "director_voice_text": "Milo tocó el plato."
    },
    {
      "beat_id": "b3",
      "function": "detalle que contradice",
      "narration": "Aún estaba tibio.",
      "new_information": "El plato sigue tibio; la cena fue reciente.",
      "visual_action": "Plano detalle del plato tapado; un hilo tenue de vapor se insinúa bajo la tapa.",
      "narration_visual_link": "El calor visible contradice la idea de olvido.",
      "characters": [
        "milo_adult"
      ],
      "world_id": "kitchen_night",
      "voice_intention": "Señalar el hallazgo sin subrayarlo.",
      "pause_after_s": 0.3,
      "text_emphasis": [
        "tibio"
      ],
      "shot": {
        "scale": "extreme_close_up",
        "motion": "static",
        "motion_reason": "El vapor y el tacto necesitan quietud.",
        "continuity": "Misma mesa, mismo plato.",
        "subtitle_safe_top": true
      },
      "transition": {
        "type": "cut",
        "duration_s": 0,
        "reason": "Del gesto al indicio térmico."
      },
      "director_direction": {
        "viewer_emotion": "sorpresa contenida",
        "narrator_intention": "hacer visible la contradicción",
        "emotional_entry": "atención",
        "emotional_exit": "confusión",
        "emphasis": "tibio",
        "pause_reason": "permitir que el calor se registre",
        "visual_sync": "el vapor aparece bajo la tapa",
        "forbidden_delivery": "no explicar aún quién lo dejó"
      },
      "director_voice_text": "Aún estaba tibio."
    },
    {
      "beat_id": "b4",
      "function": "lectura inicial",
      "narration": "Pensó que papá",
      "new_information": "Milo empieza a construir la idea de que papá se cansó.",
      "visual_action": "Rostro de Milo en penumbra; mira la silla vacía al otro lado de la mesa.",
      "narration_visual_link": "La silla vacía sostiene la interpretación de distancia.",
      "characters": [
        "milo_adult"
      ],
      "world_id": "kitchen_night",
      "voice_intention": "Duda interna, sin autocompasión.",
      "pause_after_s": 0.3,
      "text_emphasis": [
        "Pensó"
      ],
      "shot": {
        "scale": "close_up",
        "motion": "static",
        "motion_reason": "La quietud deja leer la duda en el rostro.",
        "continuity": "Milo frente a la mesa.",
        "subtitle_safe_top": true
      },
      "transition": {
        "type": "cut",
        "duration_s": 0,
        "reason": "Entrar en su interpretación."
      },
      "director_direction": {
        "viewer_emotion": "identificación",
        "narrator_intention": "mostrar su lectura sin diagnosticar",
        "emotional_entry": "confusión",
        "emotional_exit": "tristeza contenida",
        "emphasis": "Pensó",
        "pause_reason": "dejar que la idea empiece a formarse",
        "visual_sync": "la mirada cae en la silla vacía",
        "forbidden_delivery": "no confirmar que papá es frío"
      },
      "director_voice_text": "Pensó que papá"
    },
    {
      "beat_id": "b5",
      "function": "lectura inicial",
      "narration": "se había cansado de esperar.",
      "new_information": "La interpretación se completa: esperar se volvió cansancio.",
      "visual_action": "Milo baja los hombros; su sombra cubre parte del plato tapado.",
      "narration_visual_link": "La postura y la sombra completan la lectura de distancia.",
      "characters": [
        "milo_adult"
      ],
      "world_id": "kitchen_night",
      "voice_intention": "Dejar caer la frase con cansancio contenido.",
      "pause_after_s": 0.4,
      "text_emphasis": [
        "cansado de esperar"
      ],
      "shot": {
        "scale": "medium",
        "motion": "static",
        "motion_reason": "La quietud permite ver la postura derrotada.",
        "continuity": "Misma cocina, misma mesa.",
        "subtitle_safe_top": true
      },
      "transition": {
        "type": "cut",
        "duration_s": 0,
        "reason": "Cerrar la interpretación antes del giro."
      },
      "director_direction": {